{"schema_version":1,"profile":"actions-v1","state_profile":"run-parity-v1","recording_id":"clock-limit","required_features":["basic_combat","ironclad_starter_shrinker_v1"],"setup":{"kind":"seeded_combat","character":"Ironclad","ascension":0,"seed":"ORACLECHECK01","clock":{"kind":"action_clock_v1","epoch_seconds":253402300799,"seconds_per_action":0},"encounter":"SHRINKER_BEETLE_WEAK"},"actions":[{"id":"action-000001","action":{"kind":"end_turn"}},{"id":"action-000002","action":{"kind":"end_turn"}}]}
