{"schema_version":1,"profile":"actions-v1","state_profile":"run-parity-v1","recording_id":"run-shrinker-death","required_features":["run_flow_v1"],"setup":{"kind":"seeded_run","character":"Ironclad","ascension":0,"seed":"KERNELRUN14","clock":{"kind":"action_clock_v1","epoch_seconds":1700000000,"seconds_per_action":1}},"actions":[{"id":"action-000001","action":{"kind":"choose_option","option_index":0}},{"id":"action-000002","action":{"kind":"proceed"}},{"id":"action-000003","action":{"kind":"select_map_node","col":2,"row":1}},{"id":"action-000004","action":{"kind":"end_turn"}},{"id":"action-000005","action":{"kind":"end_turn"}},{"id":"action-000006","action":{"kind":"end_turn"}},{"id":"action-000007","action":{"kind":"end_turn"}},{"id":"action-000008","action":{"kind":"end_turn"}},{"id":"action-000009","action":{"kind":"end_turn"}},{"id":"action-000010","action":{"kind":"end_turn"}},{"id":"action-000011","action":{"kind":"end_turn"}},{"id":"action-000012","action":{"kind":"end_turn"}}]}
