{"schema_version":1,"profile":"actions-v1","state_profile":"run-parity-v1","recording_id":"neow-map-prefix","required_features":["run_flow_v1"],"setup":{"kind":"seeded_run","character":"Ironclad","ascension":0,"seed":"ORACLECHECK01","clock":{"kind":"action_clock_v1","epoch_seconds":1700000000,"seconds_per_action":1}},"actions":[{"id":"action-000001","action":{"kind":"choose_option","option_index":0}},{"id":"action-000002","action":{"kind":"proceed"}}]}
