{"schema_version":1,"profile":"actions-v1","state_profile":"run-parity-v1","recording_id":"combat-block-death","required_features":["basic_combat","ironclad_starter_shrinker_v1"],"setup":{"kind":"seeded_combat","character":"Ironclad","ascension":0,"seed":"ORACLECHECK01","clock":{"kind":"action_clock_v1","epoch_seconds":1700000000,"seconds_per_action":1},"encounter":"SHRINKER_BEETLE_WEAK"},"actions":[{"id":"action-000001","action":{"kind":"play_card","card_instance":"card_0"}},{"id":"action-000002","action":{"kind":"end_turn"}},{"id":"action-000003","action":{"kind":"play_card","card_instance":"card_5"}},{"id":"action-000004","action":{"kind":"end_turn"}},{"id":"action-000005","action":{"kind":"end_turn"}},{"id":"action-000006","action":{"kind":"end_turn"}},{"id":"action-000007","action":{"kind":"end_turn"}},{"id":"action-000008","action":{"kind":"end_turn"}},{"id":"action-000009","action":{"kind":"end_turn"}},{"id":"action-000010","action":{"kind":"end_turn"}},{"id":"action-000011","action":{"kind":"end_turn"}},{"id":"action-000012","action":{"kind":"end_turn"}}]}
